نام محصول,قیمت
کوله پشتی 35+5 لیتر دیوتر,"2,400,000 تومان"
کوله پشتی تاکتیکالی 20 لیتری,"1,144,000 تومان"
کوله پشتی 45+5 کله گاوی(PK),"2,523,000 تومان"
کوله پشتی تاکتیکال 25 لیتر,"500,000 تومان"
کوله پشتی 65+5 لیتر دیتور wildguest,"3,102,000 تومان"
کوله پشتی کوهنوردی 32 لیتر دیوتر,"1,638,000 تومان"
کوله حمله سالیوا مدل 9125,اتمام موجودی
کوله پشتی 25 لیتر ماموت 9199,"550,000 تومان"
کوله پشتی 45 لیتر حرفه ای outdoor,اتمام موجودی
بخاری چادر کوهنوردی Ultimate,"1,100,000 تومان"
رابط شارژ کپسول گاز کوهنوردی,"230,000 تومان"
سرشعله شیلنگ دار خرچنگی,"690,000 تومان"
منقلی باربیکیو تاشو مسافرتی,اتمام موجودی
اجاق گاز مسافرتی ZT-202,"295,000 تومان"
اجاق گاز مسافرتی K-202,"330,000 تومان"
سرشعله 4 پر پهن کمپسور مدل 411,"333,000 تومان"
کپسول کوهنوردی 450 گرمی kovea,اتمام موجودی
سرشعله کوهنوردی zyzy مدل ts,"620,000 تومان"
کپسول کوهنوردی 450 گرمی بوفالو,"220,000 تومان"
سرشعله کوهنوردی کمپسور C5,"303,600 تومان"
کارابین پیچ آلومینیومی کوهنوردی,اتمام موجودی
اره زنجیری دستی مدل جیبی,"240,000 تومان"
جعبه ابزار سفری بقا 6 عددی S.O.S,"288,000 تومان"
کاور ضدآب موبایل بنددار,"65,000 تومان"
کیت کمک های اولیه مسافرتی M1,"330,000 تومان"
ست ظروف 8 تیکه لایف کمپ,"300,000 تومان"
ست ظروف کوهنوردی تفلون  نیچرهاک,"1,150,000 تومان"
ماگ سیلیکونی تاشو,"180,000 تومان"
ظرف سیلیکونی تاشو دو قاب,"330,600 تومان"
ظرف غذای مسافرتی 4 نفره SB-3,"57,000 تومان"
فلاسک لیوانی 900ml استیل tumpler,"380,000 تومان"
جا تخم مرغ کوهنوردی 4 عددی,"65,000 تومان"
ست ظروف کوهنوردی تفلون AL-308,اتمام موجودی
ست قاشق چنگال کوهنوردی تاشو,"98,000 تومان"
ست قاشق و چنگال گیاهی کوهنوردی,"45,000 تومان"
ست قاشق و چنگال تاشو کوهنوردی,"60,000 تومان"
ست ظروف تفلون کوهنوردی berg,"950,000 تومان"
لیوان سیلیکونی  تاشو 350 میل,اتمام موجودی
چراغ چادر باطری خور کمپسور,"190,000 تومان"
چراغ شارژی کارابین دار چندکاره,"230,000 تومان"
چراغ قوه(شارژی) دوکاره جیبی,اتمام موجودی
چراغ قوه UV دار دو طیف شارژی,اتمام موجودی
چراغ چادر تاشو خورشیدی - شارژی,اتمام موجودی
چراغ قوه دوکاره پلیسی یووی - شارژی,"495,000 تومان"
چراغ پیشانی شارژی پنج لامپ,اتمام موجودی
چراغ قوه شارژی چند حالته لنز دار,اتمام موجودی
پانچو خفاشی کوهنوردی هلیدو helida,"340,000 تومان"
پانچو کوهنوردی ضدآب EVA,"140,000 تومان"
پانچو بارانی کوهنوردی سیلیکونی,اتمام موجودی
چادر 8 نفره اتوماتیک ضدآب,اتمام موجودی
چادر 4 نفره اتوماتیک ضدآب دو درب,"3,162,000 تومان"
چادر مسافرتی 8 نفره میله ای,اتمام موجودی
چادر مسافرتی 8 نفره اتوماتیک,"2,550,000 تومان"
چادر مسافرتی 6 نفره اتوماتیک,"2,300,000 تومان"
چادر مسافرتی 6 نفره میله ای,اتمام موجودی
چادر مسافرتی 4 نفره اتوماتیک,"1,950,000 تومان"
چادر مسفارتی 4 نفره میله ای,اتمام موجودی
کیسه خواب پر دیوتر لایت پک,"3,072,000 تومان"
عصا کوهنوردی کله گاوی مدل kr622,اتمام موجودی
عصا دسته خم انتی شوک بوفالو,"260,000 تومان"
عصا کوهنوردی Exponent 3-8009,اتمام موجودی
عصا کوهنوردی پیچی انتی شوک,اتمام موجودی
میز تاشو کمپینگ آلومینیومی,اتمام موجودی
عینک حرفه ای 5 لنز OAKLEY,"600,000 تومان"
عینک 4 لنز ورزشی دایزی مدل C5,"500,000 تومان"
تخت آویز ننو دو نفره چوبدار,"470,000 تومان"
تخت آویز ننو تک نفره چوبدار,"352,800 تومان"
زیرانداز نشیمن پلی استری atro,"95,000 تومان"
زیرانداز کیسه خواب بادی پیکینیو,"1,100,000 تومان"
قایق بادی 2 نفره اینتایم مدل yt-097,اتمام موجودی
بالش بادی اینتکس شیار دار,"123,000 تومان"
بالش بادی نخی کاور دار,"200,000 تومان"
بالش بادی مسافرتی گری ولف,"124,000 تومان"
بالش دور گردنی بادی مسافرتی,"60,000 تومان"
صندلی تاشو کوهنوردی چانوداگ,اتمام موجودی
چادر کوهنوردی کله گاوی مدل C2001b,اتمام موجودی
چادر کوهنوردی پکینیو مدل C2001,اتمام موجودی
کلاه سه تیکه تابستانی جک ولف,"270,000 تومان"
کیف کمری کوله شو دیوتر مدل 6012,"895,000 تومان"
کیف دوشی تاکتیکالی چند حالته 5.11,"495,000 تومان"
کیف کمری سالیوا مدل 4560,"522,000 تومان"
کیف کمری 12 لیتری outdoor,"350,000 تومان"
کیف کمری تاکتیکالی بقا Angar,"330,000 تومان"
تبر سفری کلمبیا مدل نیزه ای,"290,000 تومان"
چاقوی سفری Colombia مدلA3745,"340,000 تومان"
چاقوی سفری کلمبیا مدل B132,"325,000 تومان"
